{
  "id": "ABC123",
  "serial": "SM-2025-000123",
  "player": "Tarik Skubal",
  "set": "2020 Donruss",
  "number": "RC #257",
  "variant": "Holo Purple",
  "images": {
    "front": "/cards/ABC123-front.jpg",
    "back": "/cards/ABC123-back.jpg",
    "front_thumb": "/cards/ABC123-front-thumb.webp",
    "back_thumb": "/cards/ABC123-back-thumb.webp"
  },
  "graded_at": "2025-09-15",
  "weights": { "front": 0.8, "back": 0.2 },
  "subgrades": {
    "front": {
      "surface": 9.0,
      "centering": 9.5,
      "corners": { "tl": 9.5, "tr": 9.0, "bl": 9.5, "br": 9.0 },
      "edges": { "top": 9.5, "right": 9.0, "bottom": 9.5, "left": 9.0 },
      "remarks": {
        "surface": "Faint line under angled light",
        "centering": "Even borders",
        "corners": "Minor wear TR",
        "edges": "Clean, no chipping"
      }
    },
    "back": {
      "surface": 9.0,
      "centering": 9.0,
      "corners": { "tl": 9.0, "tr": 9.0, "bl": 9.0, "br": 9.0 },
      "edges": { "top": 9.0, "right": 9.0, "bottom": 9.0, "left": 9.0 },
      "remarks": { "surface": "Slight print speck", "centering": "", "corners": "", "edges": "" }
    }
  },
  "grade_overall": 9.4,
  "card_info": { "sport": "Baseball", "team": "Detroit Tigers" },
  "links": { "ebay_comps": "https://www.ebay.com/" },
  "compare": { "distribution": { "1":2, "2":1, "3":0, "4":4, "5":6, "6":12, "7":24, "8":30, "9":18, "10":3 } }
}
